{
  "id": "wvx.reference.json-serialize",
  "version": "1",
  "capability": { "id": "data.json.serialize", "version": "1" },
  "source": {
    "kind": "pilot-reference",
    "package": "wvx-runtime-lite-json",
    "package_version": "0.1.0"
  },
  "adapter": {
    "crate_name": "wvx-adapter-reference-json-serialize",
    "execution": "native-rust"
  }
}
