{
  "id": "serde-json.serialize",
  "version": "1",
  "capability": { "id": "data.json.serialize", "version": "1" },
  "source": {
    "kind": "crates-io",
    "package": "serde_json",
    "package_version": "1"
  },
  "adapter": {
    "crate_name": "wvx-adapter-serde-json-serialize",
    "execution": "native-rust"
  }
}
