{
    "id":  "wvx.reference.path-set",
    "version":  "1",
    "capability":  {
                       "id":  "data.json.path_set",
                       "version":  "1"
                   },
    "source":  {
                   "kind":  "pilot-reference",
                   "package":  "wvx-runtime",
                   "package_version":  "0.1.0"
               },
    "adapter":  {
                    "crate_name":  "wvx-adapter-reference-path-set",
                    "execution":  "native-rust"
                },
    "status":  "conformant",
    "evidence":  {
                     "build":  "pass",
                     "conformance":  "pass",
                     "benchmark":  "absent",
                     "license":  "pass",
                     "security":  "absent"
                 },
    "notes":  "JSON pilot; Gate A vectors pass. Not production admission."
}

