{
    "id":  "wvx.reference.io-input-bytes",
    "version":  "1",
    "capability":  {
                       "id":  "io.input.bytes",
                       "version":  "1"
                   },
    "source":  {
                   "kind":  "pilot-reference",
                   "package":  "wvx-runtime",
                   "package_version":  "0.1.0"
               },
    "adapter":  {
                    "crate_name":  "wvx-adapter-reference-io-input",
                    "execution":  "native-rust"
                },
    "status":  "candidate",
    "evidence":  {
                     "conformance":  "absent",
                     "benchmark":  "absent",
                     "security":  "absent",
                     "build":  "pass",
                     "license":  "pass"
                 },
    "notes":  "I/O seed. Candidate."
}
