{
  "id": "wvx.reference.io-output-bytes",
  "version": "1",
  "capability": { "id": "io.output.bytes", "version": "1" },
  "source": {
    "kind": "pilot-reference",
    "package": "wvx-runtime",
    "package_version": "0.1.0"
  },
  "adapter": {
    "crate_name": "wvx-adapter-reference-io-output",
    "execution": "native-rust"
  }
}
